text,transliterated,translated_text
njan oru dileepettan fananu ivde ulla dileepettan fansdoke like adikkk,ന്ജന് ഓരു ദിലീപേത്തന് fനനു ഇവ്ദേ ഉല്ല ദിലീപേത്തന് fന്സ്ദോകേ ലികേ അദിക്ക്ക്,
സൂപ്പർ ട്രൈലെർ ട്രൈലെർ കാണുമ്പോൾ തന്നെ അറിയാൻ പറ്റുന്നുണ്ട് എത്ര സീരിയസ് ആയി ഈ സിനിമയെ ഗീതു മോഹന്ദാസ് ആൻഡ് നിവിൻ പൊളി മറ്റുള്ള എല്ലാ അണിയറപ്രവർത്തകരും സമീപിച്ചിരിക്കുന്നു എന്ന് ഗുഡ് ജോബ് ടീം nb ഒരു വീഡിയോക് ലൈക് or ഡിസ് ലൈക്ക് കൊടുക്കുന്നത് കാണുന്നവരുടെ സ്വാതന്ത്ര്യം തന്നെ എങ്കിലും ഇത്ര മികച്ച ട്രൈലറിനും 1k യിൽ കൂടുതൽ ഡിസ് ലൈക്ക് ഉണ്ടെങ്കിൽ അത് കേവലം ഗീതുവിനോടോ അവരുടെ നിലപാടുകളോടോ ഉള്ള വെറുപ്പ് ആണെന്ന് മനസ്സിലാവുന്നു ഇങ്ങനെ ഡിസ് ലൈക്ക് അടിക്കുന്നവരോട് പുച്ഛം മാത്രം കഴിവിനെ അംഗീകരിക്കാൻ പഠിക്കുക ആദ്യം,സൂപ്പർ ട്രൈലെർ ട്രൈലെർ കാണുമ്പോൾ തന്നെ അറിയാൻ പറ്റുന്നുണ്ട് എത്ര സീരിയസ് ആയി ഈ സിനിമയെ ഗീതു മോഹന്ദാസ് ആൻഡ് നിവിൻ പൊളി മറ്റുള്ള എല്ലാ അണിയറപ്രവർത്തകരും സമീപിച്ചിരിക്കുന്നു എന്ന് ഗുഡ് ജോബ് ടീം ന്ബ് ഒരു വീഡിയോക് ലൈക് ഓര് ഡിസ് ലൈക്ക് കൊടുക്കുന്നത് കാണുന്നവരുടെ സ്വാതന്ത്ര്യം തന്നെ എങ്കിലും ഇത്ര മികച്ച ട്രൈലറിനും ൧ക് യിൽ കൂടുതൽ ഡിസ് ലൈക്ക് ഉണ്ടെങ്കിൽ അത് കേവലം ഗീതുവിനോടോ അവരുടെ നിലപാടുകളോടോ ഉള്ള വെറുപ്പ് ആണെന്ന് മനസ്സിലാവുന്നു ഇങ്ങനെ ഡിസ് ലൈക്ക് അടിക്കുന്നവരോട് പുച്ഛം മാത്രം കഴിവിനെ അംഗീകരിക്കാൻ പഠിക്കുക ആദ്യം,
എന്റെ പൊന്നോ ഇജ്ജാതി ഐറ്റം ഹോ കോസറാകൊള്ളി സീൻസ്,എന്റെ പൊന്നോ ഇജ്ജാതി ഐറ്റം ഹോ കോസറാകൊള്ളി സീൻസ്,
കാര്യങ്ങൾ മനസ്സിലാക്കി പ്രതികരിക്കുന്നതിനാലാണ് ലാലേട്ടൻ മറ്റുള്ളവരിൽനിന്നും വ്യത്യസ്തനാകുന്നത് ലൗ യൂ ലാലേട്ടാ,കാര്യങ്ങൾ മനസ്സിലാക്കി പ്രതികരിക്കുന്നതിനാലാണ് ലാലേട്ടൻ മറ്റുള്ളവരിൽനിന്നും വ്യത്യസ്തനാകുന്നത് ലൗ യൂ ലാലേട്ടാ,
marana waiting masssss,മരന വൈതിന്ഗ് മസ്സ്സ്സ്സ്,
ithu vera levelakum urappa ela ikka fansinum all best,ഇഥു വേര ലേവേലകുമ് ഉരപ്പ ഏല ഇക്ക fന്സിനുമ് അല്ല് ബേസ്ത്,
ആമയെ വരെ വെള്ളത്തിൽ മുക്കി കൊല്ലുന്ന ഇനമാ ഹരീഷ് കണാരൻ റോക്ക്സ്,ആമയെ വരെ വെള്ളത്തിൽ മുക്കി കൊല്ലുന്ന ഇനമാ ഹരീഷ് കണാരൻ റോക്ക്സ്,
ee cinimayude shootinginanu njan manju varriereyum anusreeyeyum neritt kanunnath at kottayam,ഈ ചിനിമയുദേ ശൂതിന്ഗിനനു ന്ജന് മന്ജു വര്രിഏരേയുമ് അനുസ്രീയേയുമ് നേരിത്ത് കനുന്നഥ് അത് കോത്തയമ്,
kurach massum aayittanallo jayetta ipravishathe varav,കുരച് മസ്സുമ് ആയിത്തനല്ലോ ജയേത്ത ഇപ്രവിശഥേ വരവ്,
last one punch superman punch madura raja special,ലസ്ത് ഓനേ പുന്ച് സുപേര്മന് പുന്ച് മദുര രജ സ്പേചിഅല്,
ഇനി ഇപ്പോ മൂക്കുത്തി എടുത്തത് ഉണ്ണി മുകുന്ദനാണൊ ഡാൻഡേഴ്സുമായി ഒരു സഹകരണവുമില്ലല്ലോ ഇരുപ്പ് കണ്ടിട്ട് ഒരു കള്ള ലക്ഷണം,ഇനി ഇപ്പോ മൂക്കുത്തി എടുത്തത് ഉണ്ണി മുകുന്ദനാണൊ ഡാൻഡേഴ്സുമായി ഒരു സഹകരണവുമില്ലല്ലോ ഇരുപ്പ് കണ്ടിട്ട് ഒരു കള്ള ലക്ഷണം,
poli padam njn ella mammooty movies kanarundu itrekku disapointed akkiya oru movie aduthundayittilla,പോലി പദമ് ന്ജ്ന് ഏല്ല മമ്മൂത്യ് മോവിഏസ് കനരുന്ദു ഇത്രേക്കു ദിസപോഇന്തേദ് അക്കിയ ഓരു മോവിഏ അദുഥുന്ദയിത്തില്ല,
നിനക്കിനി മലയാളം ഇൻഡസ്ട്രി കിടന്നു പൊളക്കാൻ പറ്റും എന്ന് തോന്നുന്നുണ്ടോ ബോസേ ബാക്കി പടം കഴിഞ്ഞിട്ട്,നിനക്കിനി മലയാളം ഇൻഡസ്ട്രി കിടന്നു പൊളക്കാൻ പറ്റും എന്ന് തോന്നുന്നുണ്ടോ ബോസേ ബാക്കി പടം കഴിഞ്ഞിട്ട്,
കാലമെത്ര മാറിയാലും ജോഷിയേട്ടന്റെ മാസ്സ് അങ്ങനൊന്നും പോയി പോവൂലാ,കാലമെത്ര മാറിയാലും ജോഷിയേട്ടന്റെ മാസ്സ് അങ്ങനൊന്നും പോയി പോവൂലാ,
mega star mammootty,മേഗ സ്തര് മമ്മൂത്ത്യ്,
pavam sanjeev pillaiku enthengilum credit kodukeda nayinte makkale,പവമ് സന്ജീവ് പില്ലൈകു ഏന്ഥേന്ഗിലുമ് ച്രേദിത് കോദുകേദ നയിന്തേ മക്കലേ,
സങ്കി ലാൽ രാജ്യം പൗരത്വ ബില്ലിൽ കത്തുമ്പോൾ മിണ്ടാതിരിക്കുന്നെ ബ്ലോഗ് ഏട്ടൻ ഒരേ ഒരു രായാവ് പോലും ജീവിതത്തിൽ വട്ട പൂജ്യം,സങ്കി ലാൽ രാജ്യം പൗരത്വ ബില്ലിൽ കത്തുമ്പോൾ മിണ്ടാതിരിക്കുന്നെ ബ്ലോഗ് ഏട്ടൻ ഒരേ ഒരു രായാവ് പോലും ജീവിതത്തിൽ വട്ട പൂജ്യം,
ഡയലോഗ് ഡെലിവറി മമ്മുക്ക മാത്രം തിരുവനന്തപുരം കോട്ടയം കൊങ്ങിണി കോഴിക്കോട് കാസറഗോഡ് ത്രിസൂർ മലപ്പുറംഎന്ന് വേണ്ട ഏത് സ്ലോകും തമിഴ് ഹിന്ദി തെലുങ്ക് കണ്ണട എന്ന് വേണ്ട അടിപൊളി ഇംഗ്ലീസും,ഡയലോഗ് ഡെലിവറി മമ്മുക്ക മാത്രം തിരുവനന്തപുരം കോട്ടയം കൊങ്ങിണി കോഴിക്കോട് കാസറഗോഡ് ത്രിസൂർ മലപ്പുറംഎന്ന് വേണ്ട ഏത് സ്ലോകും തമിഴ് ഹിന്ദി തെലുങ്ക് കണ്ണട എന്ന് വേണ്ട അടിപൊളി ഇംഗ്ലീസും,
lalettaaa vere lvl mass waiting,ലലേത്താഅ വേരേ ല്വ്ല് മസ്സ് വൈതിന്ഗ്,
കിടിലൻ ട്രൈലെർ ദുൽഖർ സൽമാൻ ഫാൻസിന്റെ വക വിജയാശംസകൾ,കിടിലൻ ട്രൈലെർ ദുൽഖർ സൽമാൻ ഫാൻസിന്റെ വക വിജയാശംസകൾ,
വല്ല കഞ്ചാവും അടിച്ചു കാണേണ്ടി വരും ഇമ്മാതിരി മലരൊക്കെ ഇവിടെ കിടന്നു ഗീർവാണം അടിക്കുന്ന വാണങ്ങളിൽ എത്രയെണ്ണം ഇത് തിയേറ്ററിൽ പോയി കാണും എന്ന് കണ്ടറിയാം,വല്ല കഞ്ചാവും അടിച്ചു കാണേണ്ടി വരും ഇമ്മാതിരി മലരൊക്കെ ഇവിടെ കിടന്നു ഗീർവാണം അടിക്കുന്ന വാണങ്ങളിൽ എത്രയെണ്ണം ഇത് തിയേറ്ററിൽ പോയി കാണും എന്ന് കണ്ടറിയാം,
wow extraordinary trailer eanna acting aanu ippolum njangada ikka kode ninnavar palarum kali marannu tudangi ikka muttanu,വോവ് ഏക്ഷ്ത്രഓര്ദിനര്യ് ത്രൈലേര് ഏഅന്ന അച്തിന്ഗ് ആനു ഇപ്പോലുമ് ന്ജന്ഗദ ഇക്ക കോദേ നിന്നവര് പലരുമ് കലി മരന്നു തുദന്ഗി ഇക്ക മുത്തനു,
മൂക്കുത്തി കാണാതായപ്പോ ഇത്രേം ഡാൻസ് അപ്പോൾ ആ അരഞ്ഞാണം എങ്ങാനും കാണാതെ പോയിരുന്നെങ്കിലോ ഹമ്മോ ഓർക്കാൻ കൂടി വയ്യ,മൂക്കുത്തി കാണാതായപ്പോ ഇത്രേം ഡാൻസ് അപ്പോൾ ആ അരഞ്ഞാണം എങ്ങാനും കാണാതെ പോയിരുന്നെങ്കിലോ ഹമ്മോ ഓർക്കാൻ കൂടി വയ്യ,
192k viewers 194k like how it is possible,൧൯൨ക് വിഏവേര്സ് ൧൯൪ക് ലികേ ഹോവ് ഇത് ഇസ് പോസ്സിബ്ലേ,
ivaloode ipoo angatte idaan parayii 2 divasam piayitte 2 manikkuure wait cheyyaan kazhiyaatha njammalooda,ഇവലൂദേ ഇപൂ അന്ഗത്തേ ഇദാന് പരയീ ൨ ദിവസമ് പിഅയിത്തേ ൨ മനിക്കൂരേ വൈത് ചേയ്യാന് കഴിയാഥ ന്ജമ്മലൂദ,
trailer എഡിറ്റിംഗ് കുറച്ചു കൂടി നന്നാകാം ആയിരുന്നു കൊള്ളാം,ത്രൈലേര് എഡിറ്റിംഗ് കുറച്ചു കൂടി നന്നാകാം ആയിരുന്നു കൊള്ളാം,
അവൾ ഒറ്റക്കാണ് വന്നത് monestar manju ചേച്ചി uyir,അവൾ ഒറ്റക്കാണ് വന്നത് മോനേസ്തര് മന്ജു ചേച്ചി ഉയിര്,
ട്രെയിലർ ഡയലോഗ് മനസിലാകാത്തവർ സബ്ടൈറ്റിൽ ഉപയോഗിച്ച് കാണുക ഭാഷ മലയാളം അല്ല ഹിന്ദിയും ലക്ഷദ്വീപ് ഭാഷയുമാണ്,ട്രെയിലർ ഡയലോഗ് മനസിലാകാത്തവർ സബ്ടൈറ്റിൽ ഉപയോഗിച്ച് കാണുക ഭാഷ മലയാളം അല്ല ഹിന്ദിയും ലക്ഷദ്വീപ് ഭാഷയുമാണ്,
മലയാള സിനിമ ഇത് എന്തിനുള്ള പുറപ്പാടാ amazing,മലയാള സിനിമ ഇത് എന്തിനുള്ള പുറപ്പാടാ അമzിന്ഗ്,
കൊല ഗാണ്ട് ല ഇരുക്കേണ് കൊള്ളമ വിടമറ്റെന് അടിപൊളി മമ്മുക്ക,കൊല ഗാണ്ട് ല ഇരുക്കേണ് കൊള്ളമ വിടമറ്റെന് അടിപൊളി മമ്മുക്ക,
സാന്റ ഇല്ലാത്ത എന്ത് ക്രിസ്തുമസ്സ് ഈ x mas സാന്റാക്കുള്ളത്,സാന്റ ഇല്ലാത്ത എന്ത് ക്രിസ്തുമസ്സ് ഈ ക്ഷ് മസ് സാന്റാക്കുള്ളത്,
katta waitinggg lalettaaaaaaa luv u so much,കത്ത വൈതിന്ഗ്ഗ്ഗ് ലലേത്താആആഅ ലുവ് ഉ സോ മുച്,
siddique te sthiram trailer pore oru ghum illa lucifer te trailer pole vere orennam kandittilla,സിദ്ദിqുഏ തേ സ്ഥിരമ് ത്രൈലേര് പോരേ ഓരു ഘുമ് ഇല്ല ലുചിfേര് തേ ത്രൈലേര് പോലേ വേരേ ഓരേന്നമ് കന്ദിത്തില്ല,
പൂമരം മൂവിയിലെ നടി ആണ് ഇതിലും neetha pillai കാളിദാസിനെകാളും മെച്ചം ആയതിലായിരിക്കും ഷൈൻ ചേട്ടൻ ഇതിൽ കൊണ്ടുവന്നത്,പൂമരം മൂവിയിലെ നടി ആണ് ഇതിലും നീഥ പില്ലൈ കാളിദാസിനെകാളും മെച്ചം ആയതിലായിരിക്കും ഷൈൻ ചേട്ടൻ ഇതിൽ കൊണ്ടുവന്നത്,
പഴയ കാല കല്ല്യാണ വീഡിയോ 1990 കണ്ടുനോക്കു,പഴയ കാല കല്ല്യാണ വീഡിയോ ൧൯൯൦ കണ്ടുനോക്കു,
പ്രളയം നടന്നപ്പോൾ kgf ബിജിഎം മിക്സ് ചെയ്ത ടീമുകൾ ഉണ്ട് അവന്മാർക്ക് വെളിവില്ലെന്നേലും പറയാം എന്നാൽ ഇത്രേം മനോഹരം ആയ ഒരു പാട്ടും സിനിമയും വല്ലവനും എഡിറ്റ് ചെയ്തേ കണ്ടു ചിരിച്ച കൂട്ടുകാർ എനിക്ക് ഉണ്ട് എന്നത് എന്നെ അത്ഭുതപ്പെടുത്തുന്നു,പ്രളയം നടന്നപ്പോൾ ക്ഗ്f് ബിജിഎം മിക്സ് ചെയ്ത ടീമുകൾ ഉണ്ട് അവന്മാർക്ക് വെളിവില്ലെന്നേലും പറയാം എന്നാൽ ഇത്രേം മനോഹരം ആയ ഒരു പാട്ടും സിനിമയും വല്ലവനും എഡിറ്റ് ചെയ്തേ കണ്ടു ചിരിച്ച കൂട്ടുകാർ എനിക്ക് ഉണ്ട് എന്നത് എന്നെ അത്ഭുതപ്പെടുത്തുന്നു,
maranamass lalettan kasari ini march 28 vare waitchayyanamallo,മരനമസ്സ് ലലേത്തന് കസരി ഇനി മര്ച് ൨൮ വരേ വൈത്ചയ്യനമല്ലോ,
all kerala mammooty fans anangill adi oru like,അല്ല് കേരല മമ്മൂത്യ് fന്സ് അനന്ഗില്ല് അദി ഓരു ലികേ,
ന്റെമ്മോ ഒരു രക്ഷയുമില്ല അവാർഡ് ഉറപ്പാ നിവിൻ spr ആരും കമന്റ് ചെയ്യാത്ത വ്യക്തിയാണ് director ഗീതു മോഹൻ ദാസ് congrats,ന്റെമ്മോ ഒരു രക്ഷയുമില്ല അവാർഡ് ഉറപ്പാ നിവിൻ സ്പ്ര് ആരും കമന്റ് ചെയ്യാത്ത വ്യക്തിയാണ് ദിരേച്തോര് ഗീതു മോഹൻ ദാസ് ചോന്ഗ്രത്സ്,
mammookka porichu salim kumarinte comedy kalakki,മമ്മൂക്ക പോരിചു സലിമ് കുമരിന്തേ ചോമേദ്യ് കലക്കി,
മരയ്കാറിനു ചിലപോൾ ദേശിയ അവാർഡ് കൊടുകുവാൻ സാധൃത കാണുനനു കാരണം പിയൻ ഒൻഡ ആള bjp എന്ന കള്ള ഹിമാറിൻ ആണ്,മരയ്കാറിനു ചിലപോൾ ദേശിയ അവാർഡ് കൊടുകുവാൻ സാധൃത കാണുനനു കാരണം പിയൻ ഒൻഡ ആള ബ്ജ്പ് എന്ന കള്ള ഹിമാറിൻ ആണ്,
ഞാൻ കണ്ടു ഞാൻ മാത്രമേ കണ്ടുള്ളു കോണത്തിലെ പടം,ഞാൻ കണ്ടു ഞാൻ മാത്രമേ കണ്ടുള്ളു കോണത്തിലെ പടം,
1 00 joby george നിനക്കിനി മലയാളം ഇൻഡസ്ട്രിയിൽ കിടന്ന് പൊളയ്ക്കാൻ പറ്റുമെന്ന് തോന്നുന്നുണ്ടോ,൧ ൦൦ ജോബ്യ് ഗേഓര്ഗേ നിനക്കിനി മലയാളം ഇൻഡസ്ട്രിയിൽ കിടന്ന് പൊളയ്ക്കാൻ പറ്റുമെന്ന് തോന്നുന്നുണ്ടോ,
it is a malayalam movie upper bahubali no more words mammokka,ഇത് ഇസ് അ മലയലമ് മോവിഏ ഉപ്പേര് ബഹുബലി നോ മോരേ വോര്ദ്സ് മമ്മോക്ക,
കാണുമ്പോൾ പഴയ കുട്ടികാലം ഓർമ വരുന്നു തിരിച്ചു കിട്ടാത്ത ആ കാലം,കാണുമ്പോൾ പഴയ കുട്ടികാലം ഓർമ വരുന്നു തിരിച്ചു കിട്ടാത്ത ആ കാലം,
മരണ maas ഇക്കാ നിങ്ങൾ thane screen presence usthad vesham ഏതായാലും ഇക്കാക്ക് അതൊരു വിഷയമല്ല jst mega star thngs,മരണ മാസ് ഇക്കാ നിങ്ങൾ ഥനേ സ്ച്രീന് പ്രേസേന്ചേ ഉസ്ഥദ് വേശമ് ഏതായാലും ഇക്കാക്ക് അതൊരു വിഷയമല്ല ജ്സ്ത് മേഗ സ്തര് ഥ്ന്ഗ്സ്,
naamoru naal kinaa kudilil chennanayunirunilaa valayaai aarum kaanaa hridaya thaalamathil urunginaamenn aarum kelkaaa prnaya jaalakatha palavuru parayumo,നാമോരു നാല് കിനാ കുദിലില് ചേന്നനയുനിരുനിലാ വലയാഇ ആരുമ് കാനാ ഹ്രിദയ ഥാലമഥില് ഉരുന്ഗിനാമേന്ന് ആരുമ് കേല്കാഅ പ്ര്നയ ജാലകഥ പലവുരു പരയുമോ,
kattaa waiting suraj ettan soubikkaa robot ettan japan chechi,കത്താ വൈതിന്ഗ് സുരജ് ഏത്തന് സോഉബിക്കാ രോബോത് ഏത്തന് ജപന് ചേചി,
once a king,ഓന്ചേ അ കിന്ഗ്,
പ്രായം തോൽക്കുന്ന പൗരുഷം മമ്മൂട്ടി ഇഷ്ടം യേശുദാസിന്റെ ശബ്ദം കൂടി ആയപ്പോൾ പാട്ട് കിടുക്കി,പ്രായം തോൽക്കുന്ന പൗരുഷം മമ്മൂട്ടി ഇഷ്ടം യേശുദാസിന്റെ ശബ്ദം കൂടി ആയപ്പോൾ പാട്ട് കിടുക്കി,
tovino mass alle eeee filmum adpoli aaakum oru rakshayum illa tovino mass aaam,തോവിനോ മസ്സ് അല്ലേ ഈഈ fില്മുമ് അദ്പോലി ആഅകുമ് ഓരു രക്ശയുമ് ഇല്ല തോവിനോ മസ്സ് ആഅമ്,
all kerala lalettan fansite ellavida ashamsakkalum,അല്ല് കേരല ലലേത്തന് fന്സിതേ ഏല്ലവിദ അശമ്സക്കലുമ്,
ഐ എം വിജയൻ ചേട്ടന്റെ സീൻ ഓർമ്മയുണ്ടോ ജോസിനെ മാത്രമായിരുന്നെങ്കിൽ നോക്കായിരുന്നു പക്ഷേ പൊറിഞ്ചു,ഐ എം വിജയൻ ചേട്ടന്റെ സീൻ ഓർമ്മയുണ്ടോ ജോസിനെ മാത്രമായിരുന്നെങ്കിൽ നോക്കായിരുന്നു പക്ഷേ പൊറിഞ്ചു,
manju chechii vere level aanu,മന്ജു ചേചീ വേരേ ലേവേല് ആനു,
looks like netflix series oru film aayi coloring mach aavunnilla,ലൂക്സ് ലികേ നേത്f്ലിക്ഷ് സേരിഏസ് ഓരു fില്മ് ആയി ചോലോരിന്ഗ് മച് ആവുന്നില്ല,
mookkinte mookkutti undallo shaddikkullile mookkutthi aayirikkum poyathu aaa payyane nokkanam,മൂക്കിന്തേ മൂക്കുത്തി ഉന്ദല്ലോ ശദ്ദിക്കുല്ലിലേ മൂക്കുത്ഥി ആയിരിക്കുമ് പോയഥു ആഅ പയ്യനേ നോക്കനമ്,
ettante katta fans oke onnu like adiche,ഏത്തന്തേ കത്ത fന്സ് ഓകേ ഓന്നു ലികേ അദിചേ,
mukuthii short film le chechim indalloooo aah kolaaaalooo,മുകുഥീ ശോര്ത് fില്മ് ലേ ചേചിമ് ഇന്ദല്ലൂഊ ആഹ് കോലാആലൂഓ,
ee teaserinu amal paul linte filmum aayi saamiyam thonnunavar like adikku,ഈ തേഅസേരിനു അമല് പൌല് ലിന്തേ fില്മുമ് ആയി സാമിയമ് ഥോന്നുനവര് ലികേ അദിക്കു,
എനിക് ഒരു 369 like തരണം only 369,എനിക് ഒരു ൩൬൯ ലികേ തരണം ഓന്ല്യ് ൩൬൯,
അസുരന്റെ വരവിനു കാത്തിരിക്കുന്ന ഇക്ക ഫാൻസ് ലൈക് ബട്ടൺ നീലം മുക്കിക്കെ ഈ വരവ് ബോക്സ് ഓഫീസിനെ പഞ്ഞിക്കിടാൻ ഉള്ള വരവാണ് അത്രക്ക് heavy ഐറ്റം ആണ് അസുരന്റെ വരവ് കാത്തിരിക്കുന്നവർ ലൈക് ചെയ്യുക,അസുരന്റെ വരവിനു കാത്തിരിക്കുന്ന ഇക്ക ഫാൻസ് ലൈക് ബട്ടൺ നീലം മുക്കിക്കെ ഈ വരവ് ബോക്സ് ഓഫീസിനെ പഞ്ഞിക്കിടാൻ ഉള്ള വരവാണ് അത്രക്ക് ഹേഅവ്യ് ഐറ്റം ആണ് അസുരന്റെ വരവ് കാത്തിരിക്കുന്നവർ ലൈക് ചെയ്യുക,
enne pole vere aareelum wait cheyth nilkunddavumo aaavo,ഏന്നേ പോലേ വേരേ ആരീലുമ് വൈത് ചേയ്ഥ് നില്കുന്ദ്ദവുമോ ആഅവോ,
