text,transliterated,translated_text
കട്ട ikka dq fans ലൈക് അടി,കട്ട ഇക്ക ദ്q് fന്സ് ലൈക് അടി,
മനുഷ്യന്റെ പല്ലുള്ള മീനിനെ കണ്ടവരുണ്ടോ ഇല്ലെങ്കിൽ ഈ വീഡിയോ കാണൂ,മനുഷ്യന്റെ പല്ലുള്ള മീനിനെ കണ്ടവരുണ്ടോ ഇല്ലെങ്കിൽ ഈ വീഡിയോ കാണൂ,
made in china appam pottaanum pottaathirikkaanum chance ind,മദേ ഇന് ചിന അപ്പമ് പോത്താനുമ് പോത്താഥിരിക്കാനുമ് ചന്ചേ ഇന്ദ്,
ee role cheyan lalettan mathrame pattu,ഈ രോലേ ചേയന് ലലേത്തന് മഥ്രമേ പത്തു,
ഇക്കയുടെ പിള്ളേർ ഈ ലൈക്ക് ബട്ടൺ നീലം മുക്കിയേച്ചും പോ,ഇക്കയുടെ പിള്ളേർ ഈ ലൈക്ക് ബട്ടൺ നീലം മുക്കിയേച്ചും പോ,
time 0 53 yesuvinte kazhuvettiya cross ithu ozhivakamayirunnu,തിമേ ൦ ൫൩ യേസുവിന്തേ കഴുവേത്തിയ ച്രോസ്സ് ഇഥു ഓഴിവകമയിരുന്നു,
margamkali super pakshe kurache stepe lalettan kalichooloo song fullum dance kalikkanamayirunu,മര്ഗമ്കലി സുപേര് പക്ശേ കുരചേ സ്തേപേ ലലേത്തന് കലിചൂലൂ സോന്ഗ് fുല്ലുമ് ദന്ചേ കലിക്കനമയിരുനു,
adipoli movie plus one life super,അദിപോലി മോവിഏ പ്ലുസ് ഓനേ ലിfേ സുപേര്,
ഇതെന്നതാ കർത്താവെ ആകെ ഒരു ജഗപൊക,ഇതെന്നതാ കർത്താവെ ആകെ ഒരു ജഗപൊക,
മലയാളം ത്രില്ലർ സിനിമ ഒരൊന്നന്നരയായിരിക്കും ല്ലേ,മലയാളം ത്രില്ലർ സിനിമ ഒരൊന്നന്നരയായിരിക്കും ല്ലേ,
tovino macha ningalude time anu adi thimarkku bai cutta support,തോവിനോ മച നിന്ഗലുദേ തിമേ അനു അദി ഥിമര്ക്കു ബൈ ചുത്ത സുപ്പോര്ത്,
അല്ല ഹമുക്കേ അന്റെ മൂക്കിമേൽ പിന്നെ തേങ്ങയാണോ ഹിമാറെ,അല്ല ഹമുക്കേ അന്റെ മൂക്കിമേൽ പിന്നെ തേങ്ങയാണോ ഹിമാറെ,
lalettan fans like super movie ikka muttwanu,ലലേത്തന് fന്സ് ലികേ സുപേര് മോവിഏ ഇക്ക മുത്ത്വനു,
padam kandit ittymaniyude trialer kannan vanavar uddoooo lalettan fans like theme adipoli,പദമ് കന്ദിത് ഇത്ത്യ്മനിയുദേ ത്രിഅലേര് കന്നന് വനവര് ഉദ്ദൂഊ ലലേത്തന് fന്സ് ലികേ ഥേമേ അദിപോലി,
kidiloski padam sheriyaya psych padam fahade,കിദിലോസ്കി പദമ് ശേരിയയ പ്സ്യ്ച് പദമ് fഹദേ,
ഇത്ര നന്നായി മമ്മൂക്ക ഡാൻസ് കളിച്ച മറ്റൊരു പടം ഇല്ല ചിലപ്പോൾ ആ സോങ്ങും മമ്മൂക്കയുടെ ക്യാരക്ടറും തമ്മിലുള്ള അടുപ്പം കൊണ്ടാവാം തിയേറ്റർ എക്സ്പീരിയൻസ് വേറെ ലെവൽ അയിരുന്നു,ഇത്ര നന്നായി മമ്മൂക്ക ഡാൻസ് കളിച്ച മറ്റൊരു പടം ഇല്ല ചിലപ്പോൾ ആ സോങ്ങും മമ്മൂക്കയുടെ ക്യാരക്ടറും തമ്മിലുള്ള അടുപ്പം കൊണ്ടാവാം തിയേറ്റർ എക്സ്പീരിയൻസ് വേറെ ലെവൽ അയിരുന്നു,
ഒരു 1 million like kodukku mammuka ഫാൻസ് റെഡിയല്ലേ,ഒരു ൧ മില്ലിഓന് ലികേ കോദുക്കു മമ്മുക ഫാൻസ് റെഡിയല്ലേ,
super mass ka baap loading,സുപേര് മസ്സ് ക ബാപ് ലോഅദിന്ഗ്,
paattinu entho athra feel kittunnilla valare eluppathil vere kure paattinte tune adichu matti undakiya pole thonunnu,പാത്തിനു ഏന്ഥോ അഥ്ര fീല് കിത്തുന്നില്ല വലരേ ഏലുപ്പഥില് വേരേ കുരേ പാത്തിന്തേ തുനേ അദിചു മത്തി ഉന്ദകിയ പോലേ ഥോനുന്നു,
ithokke comedy pole und aa bahubaliyude manam kalayo,ഇഥോക്കേ ചോമേദ്യ് പോലേ ഉന്ദ് ആ ബഹുബലിയുദേ മനമ് കലയോ,
13k dislike kodutha yethu mire adaaa,൧൩ക് ദിസ്ലികേ കോദുഥ യേഥു മിരേ അദാഅ,
ikkante eazhrikath varilla ikkante varunnu kunjali marakkar waiting ikka polikkum,ഇക്കന്തേ ഏഅഴ്രികഥ് വരില്ല ഇക്കന്തേ വരുന്നു കുന്ജലി മരക്കര് വൈതിന്ഗ് ഇക്ക പോലിക്കുമ്,
മൂക്കുത്തി കാണാനില്ലെങ്കിലും കക്ഷം ഇഷ്ടം പോലെ കാണാൻ ഉണ്ട് ഇതെന്ത് കക്ഷത്തിന്റെ സംസ്ഥാന സമ്മേളനമോ,മൂക്കുത്തി കാണാനില്ലെങ്കിലും കക്ഷം ഇഷ്ടം പോലെ കാണാൻ ഉണ്ട് ഇതെന്ത് കക്ഷത്തിന്റെ സംസ്ഥാന സമ്മേളനമോ,
poli poli poli am waiting,പോലി പോലി പോലി അമ് വൈതിന്ഗ്,
njan oru ikka fanannengilum lalettan onnam polikatte,ന്ജന് ഓരു ഇക്ക fനന്നേന്ഗിലുമ് ലലേത്തന് ഓന്നമ് പോലികത്തേ,
വിനീത് ശ്രീനിവാസൻ ഫാൻസ് ആരെങ്കിലും ഉണ്ടോ hit,വിനീത് ശ്രീനിവാസൻ ഫാൻസ് ആരെങ്കിലും ഉണ്ടോ ഹിത്,
padachone mammookante ee padom moonjunna lakshanamaanallo ithinoru avasaanamille,പദചോനേ മമ്മൂകന്തേ ഈ പദോമ് മൂന്ജുന്ന ലക്ശനമാനല്ലോ ഇഥിനോരു അവസാനമില്ലേ,
സിനിമ റീലിസിനു ശേഷം ഇന്നലെ ആണ് എന്നിക് സിനിമ കാണാൻ പറ്റിയത് ഒന്നും പറയാൻ ഇല്ല kidilam പടം സൂപ്പർ കോമഡി ഈ പടം കണ്ടിട്ടു adaar love എടുത്തു കത്തിച്ചു കളയാൻ ആണ് തോന്നുനെ വിനീത് sreenivasan പൊളി ചിരിച്ചു ഒരു parivam ആയി,സിനിമ റീലിസിനു ശേഷം ഇന്നലെ ആണ് എന്നിക് സിനിമ കാണാൻ പറ്റിയത് ഒന്നും പറയാൻ ഇല്ല കിദിലമ് പടം സൂപ്പർ കോമഡി ഈ പടം കണ്ടിട്ടു അദാര് ലോവേ എടുത്തു കത്തിച്ചു കളയാൻ ആണ് തോന്നുനെ വിനീത് സ്രീനിവസന് പൊളി ചിരിച്ചു ഒരു പരിവമ് ആയി,
ഈ പാട്ട് എല്ലാ ഭാഷയിലും കണ്ടും കേട്ടും ഇപ്പോൾ കൂടുതൽ ഇഷ്ടമായി ആദ്യം ഈ പാട്ട് കണ്ടപ്പോൾ എവിടെയോ ഒരു കുറവുള്ള പോലെ തോന്നിയിരുന്നു ഇപ്പോൾ സൂപ്പർ ഇനി ഈ നായികയെയോ പാട്ടിനെയോ പറ്റി കുറ്റം പറയുന്നവർക്ക് വെറുതെ പറഞ്ഞ് കൊണ്ടിരിക്കാം പിന്നെ ഞാൻ ഈ സിനിമക്ക് ടിക്കറ്റ് എടുക്കുന്നത് ധീരനും വീരനുമായ അച്യുതൻ എന്ന കുട്ടിയുടെ പ്രകടനം കാണാനാണ് പിന്നെ മമ്മൂക്കയും ഉണ്ണിമുകുന്ദനും പൊളിച്ചടുക്കും നവംബർ 21 ആകാൻ കാത്തിരിക്കുന്നു,ഈ പാട്ട് എല്ലാ ഭാഷയിലും കണ്ടും കേട്ടും ഇപ്പോൾ കൂടുതൽ ഇഷ്ടമായി ആദ്യം ഈ പാട്ട് കണ്ടപ്പോൾ എവിടെയോ ഒരു കുറവുള്ള പോലെ തോന്നിയിരുന്നു ഇപ്പോൾ സൂപ്പർ ഇനി ഈ നായികയെയോ പാട്ടിനെയോ പറ്റി കുറ്റം പറയുന്നവർക്ക് വെറുതെ പറഞ്ഞ് കൊണ്ടിരിക്കാം പിന്നെ ഞാൻ ഈ സിനിമക്ക് ടിക്കറ്റ് എടുക്കുന്നത് ധീരനും വീരനുമായ അച്യുതൻ എന്ന കുട്ടിയുടെ പ്രകടനം കാണാനാണ് പിന്നെ മമ്മൂക്കയും ഉണ്ണിമുകുന്ദനും പൊളിച്ചടുക്കും നവംബർ ൨൧ ആകാൻ കാത്തിരിക്കുന്നു,
mammokkayude madurarajakku shesham adutha super hit,മമ്മോക്കയുദേ മദുരരജക്കു ശേശമ് അദുഥ സുപേര് ഹിത്,
rajauda kalii enum keralam kannan pokunnaa olluu,രജൌദ കലീ ഏനുമ് കേരലമ് കന്നന് പോകുന്നാ ഓല്ലൂ,
ith dislike adicha polayadii makkalkk kunna namaskkaram,ഇഥ് ദിസ്ലികേ അദിച പോലയദീ മക്കല്ക്ക് കുന്ന നമസ്ക്കരമ്,
mammookka look and diolouge uff oru rakshayum illa,മമ്മൂക്ക ലൂക് അന്ദ് ദിഓലോഉഗേ ഉf്f് ഓരു രക്ശയുമ് ഇല്ല,
mammuka massan parayunavar like cheyyuga,മമ്മുക മസ്സന് പരയുനവര് ലികേ ചേയ്യുഗ,
lucifer inte munnil enthonn raaja ettan da,ലുചിfേര് ഇന്തേ മുന്നില് ഏന്ഥോന്ന് രാജ ഏത്തന് ദ,
മവനെ കൊല ഗാണ്ടിൽ ഇറുക്കെ കൊല്ലാമാ വിടമാട്ടെ,മവനെ കൊല ഗാണ്ടിൽ ഇറുക്കെ കൊല്ലാമാ വിടമാട്ടെ,
രവി സാറില്ലെക്കിൽ ഒരു രസവും ഇല്ല വിനീത് എട്ടൻ ഇഷ്ട്ടം,രവി സാറില്ലെക്കിൽ ഒരു രസവും ഇല്ല വിനീത് എട്ടൻ ഇഷ്ട്ടം,
പാട്ട് പോരാ ട്യൂൺ നന്നായില്ല,പാട്ട് പോരാ ട്യൂൺ നന്നായില്ല,
മൂക്കുത്തി എടുത്തത് ഉണ്ണി മുകുന്ദൻ ആണ് എന്ന് മനസിലാക്കി അത് പാടി പാടി അയാളുടെ കയ്യിൽ നിന്ന് മൂക്കുത്തി തിരിച്ചു മേടിക്കാൻ ഒള്ള ആ കുട്ടീടെ സൈക്കിൾഓടിക്കൽ മൂവ്,മൂക്കുത്തി എടുത്തത് ഉണ്ണി മുകുന്ദൻ ആണ് എന്ന് മനസിലാക്കി അത് പാടി പാടി അയാളുടെ കയ്യിൽ നിന്ന് മൂക്കുത്തി തിരിച്ചു മേടിക്കാൻ ഒള്ള ആ കുട്ടീടെ സൈക്കിൾഓടിക്കൽ മൂവ്,
uff romanjam kond irinaduth ninn njan enit ninn poyi,ഉf്f് രോമന്ജമ് കോന്ദ് ഇരിനദുഥ് നിന്ന് ന്ജന് ഏനിത് നിന്ന് പോയി,
ee shane te abhinayam kanumboya pranav mohanlalineyum dulqer salmaneyum eduth kinattil kalayan thonunath,ഈ ശനേ തേ അഭിനയമ് കനുമ്ബോയ പ്രനവ് മോഹന്ലലിനേയുമ് ദുല്qേര് സല്മനേയുമ് ഏദുഥ് കിനത്തില് കലയന് ഥോനുനഥ്,
kung fu class kazhiju vanna udane kandath orupad sandhoshm malayalam il oru kung fu movie,കുന്ഗ് fു ച്ലസ്സ് കഴിജു വന്ന ഉദനേ കന്ദഥ് ഓരുപദ് സന്ധോശ്മ് മലയലമ് ഇല് ഓരു കുന്ഗ് fു മോവിഏ,
ഒരു 2 nd ട്രെയിലർ വേണം ഇൗ വീഡിയോന്റെ thumbnailum മാറ്റൂ ട്രെയിലർ മോശം ആക്കിയെങ്കിലും പടം സൂപ്പർഹിറ്റ് ആയ റൺ ബേബി റൺ പോലേയവനെ ഇൗ സിനിമയും എന്ന് ആഗ്രഹിക്കുന്നുലാലേട്ടൻ,ഒരു ൨ ന്ദ് ട്രെയിലർ വേണം ഇൗ വീഡിയോന്റെ ഥുമ്ബ്നൈലുമ് മാറ്റൂ ട്രെയിലർ മോശം ആക്കിയെങ്കിലും പടം സൂപ്പർഹിറ്റ് ആയ റൺ ബേബി റൺ പോലേയവനെ ഇൗ സിനിമയും എന്ന് ആഗ്രഹിക്കുന്നുലാലേട്ടൻ,
ഈ തടിയനെ വെച്ചേ ആരെങ്കിലും പടം എടുക്കോ,ഈ തടിയനെ വെച്ചേ ആരെങ്കിലും പടം എടുക്കോ,
oooohhhh oru rakshayum illaaaa pwolii poppwoliiii ingalaan thaaram,ഊഊഹ്ഹ്ഹ്ഹ് ഓരു രക്ശയുമ് ഇല്ലാആ പ്വോലീ പോപ്പ്വോലീഈ ഇന്ഗലാന് ഥാരമ്,
you tube hang ayo 34k views change avunnilalo,യോഉ തുബേ ഹന്ഗ് അയോ ൩൪ക് വിഏവ്സ് ചന്ഗേ അവുന്നിലലോ,
ഈ കുട്ടീടെ മൂക്കുത്തി ആരേലും എടുത്തിട്ടുണ്ടേൽ കൊടുത്തേക്ക്,ഈ കുട്ടീടെ മൂക്കുത്തി ആരേലും എടുത്തിട്ടുണ്ടേൽ കൊടുത്തേക്ക്,
eattante pooram kazhinjaal ikkayude kodiyett lalettanum mammookkaykkum pakaram vekkaaan aaarumillaaaa,ഏഅത്തന്തേ പൂരമ് കഴിന്ജാല് ഇക്കയുദേ കോദിയേത്ത് ലലേത്തനുമ് മമ്മൂക്കയ്ക്കുമ് പകരമ് വേക്കാഅന് ആഅരുമില്ലാആ,
10m view akkan try cheyyunnavar like adi,൧൦മ് വിഏവ് അക്കന് ത്ര്യ് ചേയ്യുന്നവര് ലികേ അദി,
പടം ഇറങ്ങുന്നതിന് മുൻപ് തന്നേ ഞങ്ങൾ പറയും സൂപ്പർ ഹിറ്റ്,പടം ഇറങ്ങുന്നതിന് മുൻപ് തന്നേ ഞങ്ങൾ പറയും സൂപ്പർ ഹിറ്റ്,
rafeeq ahammed enna kavikk engane ingane oru paatt ezhudhan thonni atleast ee pennungale mookkuthi edth ozhivaakkeeett dance cheyaamarnnu,രfീq് അഹമ്മേദ് ഏന്ന കവിക്ക് ഏന്ഗനേ ഇന്ഗനേ ഓരു പാത്ത് ഏഴുധന് ഥോന്നി അത്ലേഅസ്ത് ഈ പേന്നുന്ഗലേ മൂക്കുഥി ഏദ്ഥ് ഓഴിവാക്കീഏത്ത് ദന്ചേ ചേയാമര്ന്നു,
mammookka ithelum mass aayi big b il varunnund ith verum sample,മമ്മൂക്ക ഇഥേലുമ് മസ്സ് ആയി ബിഗ് ബ് ഇല് വരുന്നുന്ദ് ഇഥ് വേരുമ് സമ്പ്ലേ,
പടം പൊട്ടി പന്നാ സാവും ടൈലർ ഒന്നിനും കൊള്ളില്ല ഒരു സംഭവവും അ ട്രാക്റ്റീവല്ല ഒരു മാതിരി പെരുച്ചാഴി സിനിമക്ക് ഡ്രാമ സിനിമയിലുണ്ടായ പോലൊരു തൊട്ടിപ്പടം,പടം പൊട്ടി പന്നാ സാവും ടൈലർ ഒന്നിനും കൊള്ളില്ല ഒരു സംഭവവും അ ട്രാക്റ്റീവല്ല ഒരു മാതിരി പെരുച്ചാഴി സിനിമക്ക് ഡ്രാമ സിനിമയിലുണ്ടായ പോലൊരു തൊട്ടിപ്പടം,
അവകാശ വാദങ്ങൾ ഒന്നും തന്നെ ഇല്ല പുതുമുഖ സംവിധായകർ ആണ് ലൂസിഫർ പോലെ മുഴുനീള മാസ്സ് ആക്ഷൻ രംഗങ്ങൾ ഇല്ല പക്ഷെ ഒന്ന് ഞങ്ങൾക്ക് ഉറപ്പാണ് അഭിനയം കാരണം നായകന്റെ പേര് മോഹൻലാൽ ലാലേട്ടൻ എന്നാണ് അഭിനയിക്കാൻ പറഞ്ഞാൽ ജീവിച്ച് കാണിക്കുന്ന ഐറ്റം,അവകാശ വാദങ്ങൾ ഒന്നും തന്നെ ഇല്ല പുതുമുഖ സംവിധായകർ ആണ് ലൂസിഫർ പോലെ മുഴുനീള മാസ്സ് ആക്ഷൻ രംഗങ്ങൾ ഇല്ല പക്ഷെ ഒന്ന് ഞങ്ങൾക്ക് ഉറപ്പാണ് അഭിനയം കാരണം നായകന്റെ പേര് മോഹൻലാൽ ലാലേട്ടൻ എന്നാണ് അഭിനയിക്കാൻ പറഞ്ഞാൽ ജീവിച്ച് കാണിക്കുന്ന ഐറ്റം,
ഈ ട്രെയിലർ എത്രാമത്തെ തവണയാണ് കാണണേന്ന് ഒരു പിടീം ഇല്ലാ ഒരു രക്ഷേം ഇല്ലാട്ട,ഈ ട്രെയിലർ എത്രാമത്തെ തവണയാണ് കാണണേന്ന് ഒരു പിടീം ഇല്ലാ ഒരു രക്ഷേം ഇല്ലാട്ട,
ജസ്ലയെ കളിയാക്കാൻ ഫിറോസ് ക ഇറക്കിയ പാട്ടാണെന്നു ആരും പറയാത്തത് ഭാഗ്യം,ജസ്ലയെ കളിയാക്കാൻ ഫിറോസ് ക ഇറക്കിയ പാട്ടാണെന്നു ആരും പറയാത്തത് ഭാഗ്യം,
kelkuthorum estam kudi kudi varuund pattinod,കേല്കുഥോരുമ് ഏസ്തമ് കുദി കുദി വരൂന്ദ് പത്തിനോദ്,
മൂത്തൊൻ പെടക്കും നിവിൻ മുത്തേ ഇത് ഒരു ഒന്നൊന്നര സ്റ്റോറി ആണ് അങ്ങ് ദൂരെ ലക്ഷദീപ് ൽ,മൂത്തൊൻ പെടക്കും നിവിൻ മുത്തേ ഇത് ഒരു ഒന്നൊന്നര സ്റ്റോറി ആണ് അങ്ങ് ദൂരെ ലക്ഷദീപ് ൽ,
raja alla devil devil king lucifer,രജ അല്ല ദേവില് ദേവില് കിന്ഗ് ലുചിfേര്,
ബാബു നമ്പൂതിരി അങ്ങേര് എടുത്തു കാണും,ബാബു നമ്പൂതിരി അങ്ങേര് എടുത്തു കാണും,
രണ്ട് പടം പൊട്ടിയാൽ തീരുന്നതാണ് producer കലാകാരനു അവൻ ജീവിക്കുന്ന കാലത്തോളം അവന്റെ കഴിവ് കൂടെയുണ്ടാകും അതു മതി മുന്നോട്ട് കുതിക്കുവാൻ,രണ്ട് പടം പൊട്ടിയാൽ തീരുന്നതാണ് പ്രോദുചേര് കലാകാരനു അവൻ ജീവിക്കുന്ന കാലത്തോളം അവന്റെ കഴിവ് കൂടെയുണ്ടാകും അതു മതി മുന്നോട്ട് കുതിക്കുവാൻ,
ഡീഗ്രേഡ് ചെയ്തവരുടെ അണ്ണാക്കിലേക്ക് ഉള്ള ഐറ്റം കോളനി വാണങ്ങൽ കേട്ടോടാ,ഡീഗ്രേഡ് ചെയ്തവരുടെ അണ്ണാക്കിലേക്ക് ഉള്ള ഐറ്റം കോളനി വാണങ്ങൽ കേട്ടോടാ,
avasanthe thalaivaa vili pinne aah fight hywaaahh polichadukki,അവസന്ഥേ ഥലൈവാ വിലി പിന്നേ ആഹ് fിഘ്ത് ഹ്യ്വാഅഹ്ഹ് പോലിചദുക്കി,
moopar ottakka vannad ottak thanne kond povum raja,മൂപര് ഓത്തക്ക വന്നദ് ഓത്തക് ഥന്നേ കോന്ദ് പോവുമ് രജ,
laletan and mamookaa fan katta waiting for madhuraraja,ലലേതന് അന്ദ് മമൂകാ fന് കത്ത വൈതിന്ഗ് fോര് മധുരരജ,
haters noke kurachu kanjii edukatte pakkaa mass,ഹതേര്സ് നോകേ കുരചു കന്ജീ ഏദുകത്തേ പക്കാ മസ്സ്,
ethanoo trailer kandapalla enta ammoo bhodam poyi padam moonjiyaa,ഏഥനൂ ത്രൈലേര് കന്ദപല്ല ഏന്ത അമ്മൂ ഭോദമ് പോയി പദമ് മൂന്ജിയാ,
kidu marana mas verithanam kidukki trailer kidu nivin annan polikkum,കിദു മരന മസ് വേരിഥനമ് കിദുക്കി ത്രൈലേര് കിദു നിവിന് അന്നന് പോലിക്കുമ്,
mohanlal chettan tovino lalletande aniyan ee combination iniyum kannan agraham ullavar like adiche,മോഹന്ലല് ചേത്തന് തോവിനോ ലല്ലേതന്ദേ അനിയന് ഈ ചോമ്ബിനതിഓന് ഇനിയുമ് കന്നന് അഗ്രഹമ് ഉല്ലവര് ലികേ അദിചേ,
njan oru selfi edukkum ekkkade kooda ninnu,ന്ജന് ഓരു സേല്fി ഏദുക്കുമ് ഏക്ക്കദേ കൂദ നിന്നു,
ntammo ikka pwolichu padam kidu aayirikkum,ന്തമ്മോ ഇക്ക പ്വോലിചു പദമ് കിദു ആയിരിക്കുമ്,
ഇട്ടിമാണിക്ക് രാജുവേട്ടന് ഫാന് സിന്റെ എല്ലാവിധ ആശംസകളും നേരുന്നു,ഇട്ടിമാണിക്ക് രാജുവേട്ടന് ഫാന് സിന്റെ എല്ലാവിധ ആശംസകളും നേരുന്നു,
toveee ichayo trailer kandu aaake excitement adichu irikkuva film ethrayum vegham theater lu ethiyengil,തോവീഏ ഇചയോ ത്രൈലേര് കന്ദു ആഅകേ ഏക്ഷ്ചിതേമേന്ത് അദിചു ഇരിക്കുവ fില്മ് ഏഥ്രയുമ് വേഘമ് ഥേഅതേര് ലു ഏഥിയേന്ഗില്,
കലാഭവൻ മണി അവസാനമായി പാടി അഭിനയിച്ച വീഡിയോ ആൽബം കോളിളക്കം,കലാഭവൻ മണി അവസാനമായി പാടി അഭിനയിച്ച വീഡിയോ ആൽബം കോളിളക്കം,
royal mech yenda college il mechanical la penn undu,രോയല് മേച് യേന്ദ ചോല്ലേഗേ ഇല് മേചനിചല് ല പേന്ന് ഉന്ദു,
