text,transliterated,translated_text
ee fan fight iniyum ninille makkale oru moviene degrade chyan palarkum entha ulsaham negative adichum kuttam paranjum bejaaravand nanavan noku ps ini ithinu pongala aytu veranda njn oru sectione mathram udheshich paranjadalla thammil thalluna ella nadanmardem oola fansine udheshichanu go get a life guys ningal ethra kedan korachalum athu mammokaneyo lalettaneyo oru nilakum affect chyilla ekkalavum malayala cinemayude thaararajakanmarayt avaru vazthapedum both are equal arum arkum superior alla pinne avaru thammil oru prblom illa moreover dey r gud frnds pinnenthinanu ningal ee fanskaaru parasparam mannuvari eriyane kashtam thanne nalladh kandal appreciate chyan padika allathe oru nadante fan ayathinte peril mattoru nadante ella moviesnem kuttam parayanadu athra nalla pravanadayalla,ഈ fന് fിഘ്ത് ഇനിയുമ് നിനില്ലേ മക്കലേ ഓരു മോവിഏനേ ദേഗ്രദേ ച്യന് പലര്കുമ് ഏന്ഥ ഉല്സഹമ് നേഗതിവേ അദിചുമ് കുത്തമ് പരന്ജുമ് ബേജാരവന്ദ് നനവന് നോകു പ്സ് ഇനി ഇഥിനു പോന്ഗല അയ്തു വേരന്ദ ന്ജ്ന് ഓരു സേച്തിഓനേ മഥ്രമ് ഉധേശിച് പരന്ജദല്ല ഥമ്മില് ഥല്ലുന ഏല്ല നദന്മര്ദേമ് ഊല fന്സിനേ ഉധേശിചനു ഗോ ഗേത് അ ലിfേ ഗുയ്സ് നിന്ഗല് ഏഥ്ര കേദന് കോരചലുമ് അഥു മമ്മോകനേയോ ലലേത്തനേയോ ഓരു നിലകുമ് അf്fേച്ത് ച്യില്ല ഏക്കലവുമ് മലയല ചിനേമയുദേ ഥാരരജകന്മരയ്ത് അവരു വz്ഥപേദുമ് ബോഥ് അരേ ഏqുഅല് അരുമ് അര്കുമ് സുപേരിഓര് അല്ല പിന്നേ അവരു ഥമ്മില് ഓരു പ്ര്ബ്ലോമ് ഇല്ല മോരേഓവേര് ദേയ് ര് ഗുദ് f്ര്ന്ദ്സ് പിന്നേന്ഥിനനു നിന്ഗല് ഈ fന്സ്കാരു പരസ്പരമ് മന്നുവരി ഏരിയനേ കശ്തമ് ഥന്നേ നല്ലധ് കന്ദല് അപ്പ്രേചിഅതേ ച്യന് പദിക അല്ലഥേ ഓരു നദന്തേ fന് അയഥിന്തേ പേരില് മത്തോരു നദന്തേ ഏല്ല മോവിഏസ്നേമ് കുത്തമ് പരയനദു അഥ്ര നല്ല പ്രവനദയല്ല,
ithupolathe kidilan trailer vannitt katta support kodukkathirikkan pattumo it is very awesome,ഇഥുപോലഥേ കിദിലന് ത്രൈലേര് വന്നിത്ത് കത്ത സുപ്പോര്ത് കോദുക്കഥിരിക്കന് പത്തുമോ ഇത് ഇസ് വേര്യ് അവേസോമേ,
അവസാനം വരെ ok ലാസ്റ്റ് കുളമാക്കി എന്ത് പറ്റി ജോഷി,അവസാനം വരെ ഓക് ലാസ്റ്റ് കുളമാക്കി എന്ത് പറ്റി ജോഷി,
ഊള patt mookkuthy കണ്ടില്ല polum,ഊള പത്ത് മൂക്കുഥ്യ് കണ്ടില്ല പോലുമ്,
സസ്പെൻഷൻ പോര തല്ലിപ്പൊളി വണ്ടിയാണ് മത്തൻ ദിനങ്ങൾ,സസ്പെൻഷൻ പോര തല്ലിപ്പൊളി വണ്ടിയാണ് മത്തൻ ദിനങ്ങൾ,
trailor പൊളിക്കും ഫഹദിക്ക nys waitng,ത്രൈലോര് പൊളിക്കും ഫഹദിക്ക ന്യ്സ് വൈത്ന്ഗ്,
ഒരു ചരിത്ര സിനിമയ്ക്ക് നൽകിയ സംഗീതം വളരെ ബോറ് ജയചന്ദ്രൻ്റെ താളം പറച്ചില് കേട്ടാൽ അയാള് എന്തൊക്കെയോ ആണെന്നാണല്ലോ,ഒരു ചരിത്ര സിനിമയ്ക്ക് നൽകിയ സംഗീതം വളരെ ബോറ് ജയചന്ദ്രൻ്റെ താളം പറച്ചില് കേട്ടാൽ അയാള് എന്തൊക്കെയോ ആണെന്നാണല്ലോ,
mass movie ka bap ajay vasudeve,മസ്സ് മോവിഏ ക ബപ് അജയ് വസുദേവേ,
vanam vittu vanam vittu poyilla,വനമ് വിത്തു വനമ് വിത്തു പോയില്ല,
ayyoo mohanlal sangiallleeeee poyi chawada kalla cummi a,അയ്യൂ മോഹന്ലല് സന്ഗിഅല്ല്ലീഈഏ പോയി ചവദ കല്ല ചുമ്മി അ,
chemban supper joju kidu kalipp aayath jojune kollunnath climax onnu maattipidikamarunnu joshy sire,ചേമ്ബന് സുപ്പേര് ജോജു കിദു കലിപ്പ് ആയഥ് ജോജുനേ കോല്ലുന്നഥ് ച്ലിമക്ഷ് ഓന്നു മാത്തിപിദികമരുന്നു ജോശ്യ് സിരേ,
mookil oru 5 pavante mookothi und ennitum penpullaykk mookuthi venamenn,മൂകില് ഓരു ൫ പവന്തേ മൂകോഥി ഉന്ദ് ഏന്നിതുമ് പേന്പുല്ലയ്ക്ക് മൂകുഥി വേനമേന്ന്,
marichu veezhumbol ulla aa nanaja kai athile katti romam lalettan thanne aano i mean double role,മരിചു വീഴുമ്ബോല് ഉല്ല ആ നനജ കൈ അഥിലേ കത്തി രോമമ് ലലേത്തന് ഥന്നേ ആനോ ഇ മേഅന് ദോഉബ്ലേ രോലേ,
ഈ film ആരെങ്കിലും കണ്ടവർ ഉണ്ടോ അഭിപ്രായം അറിയാനാ,ഈ fില്മ് ആരെങ്കിലും കണ്ടവർ ഉണ്ടോ അഭിപ്രായം അറിയാനാ,
jayasuriya vijaya babu combination after aadu movie,ജയസുരിയ വിജയ ബബു ചോമ്ബിനതിഓന് അf്തേര് ആദു മോവിഏ,
പത്രം ഫിലിമിലെ ആ മഞ്ചു ചേച്ചിന്റെ ഒരു പവർ കാണുന്നപോലെ ലേഡി സൂപ്പർസ്റ്റാർ ശരിക്കും ഈ ഈ ഈ ഈ ഈ മൊതലാണേ,പത്രം ഫിലിമിലെ ആ മഞ്ചു ചേച്ചിന്റെ ഒരു പവർ കാണുന്നപോലെ ലേഡി സൂപ്പർസ്റ്റാർ ശരിക്കും ഈ ഈ ഈ ഈ ഈ മൊതലാണേ,
chinenu oru muthalu verum enu ketapoo ithraku pratheeshichilaa,ചിനേനു ഓരു മുഥലു വേരുമ് ഏനു കേതപൂ ഇഥ്രകു പ്രഥീശിചിലാ,
0 15 aa musicinu vendi wait cheyyuva,൦ ൧൫ ആ മുസിചിനു വേന്ദി വൈത് ചേയ്യുവ,
ഇജ്ജാതി ഹെവി സോങ് മമ്മൂസെ ഇടിക്കട്ട വെയ്റ്റിങ് ഫോർ മാമാങ്കം,ഇജ്ജാതി ഹെവി സോങ് മമ്മൂസെ ഇടിക്കട്ട വെയ്റ്റിങ് ഫോർ മാമാങ്കം,
best wishes megastar from shivarajkumar fans karnataka,ബേസ്ത് വിശേസ് മേഗസ്തര് f്രോമ് ശിവരജ്കുമര് fന്സ് കര്നതക,
ന്റെ പൊന്നൊ മലയാള സിനിമ വേറെ ലെവൽ,ന്റെ പൊന്നൊ മലയാള സിനിമ വേറെ ലെവൽ,
lalltten fansinte best of luck for dilepptan,ലല്ല്ത്തേന് fന്സിന്തേ ബേസ്ത് ഓf് ലുച്ക് fോര് ദിലേപ്പ്തന്,
നിനക്കിനി മലയാളം industryൽ കിടന്നു പൊളക്കാൻ പറ്റുവോന്നു തോന്നുന്നുണ്ടോ കൊള്ളേണ്ടടുത്ത് കൊള്ളുന്ന dialogue dedicated to worse lal fans കൊല ഗാണ്ടുലെയിറിക്കെ മവനെ കൊല്ലാമേ വിടമാട്ടെ സിരപ്പാന തരമാന സംഭവങ്ങളെ ഇനിമേതാൻ പാക്ക പോരെ അസുരൻ വരവറിയിച്ചു കഴിഞ്ഞു മാസ്സ അല്ല മരണ മാസ്സ് അല്ല അതുക്കും മേലെ ajai ഏട്ടൻ മുത്താണ് വെറിത്തനം heavyyy item മമ്മൂക്ക ummvvaahhhh,നിനക്കിനി മലയാളം ഇന്ദുസ്ത്ര്യ്ൽ കിടന്നു പൊളക്കാൻ പറ്റുവോന്നു തോന്നുന്നുണ്ടോ കൊള്ളേണ്ടടുത്ത് കൊള്ളുന്ന ദിഅലോഗുഏ ദേദിചതേദ് തോ വോര്സേ ലല് fന്സ് കൊല ഗാണ്ടുലെയിറിക്കെ മവനെ കൊല്ലാമേ വിടമാട്ടെ സിരപ്പാന തരമാന സംഭവങ്ങളെ ഇനിമേതാൻ പാക്ക പോരെ അസുരൻ വരവറിയിച്ചു കഴിഞ്ഞു മാസ്സ അല്ല മരണ മാസ്സ് അല്ല അതുക്കും മേലെ അജൈ ഏട്ടൻ മുത്താണ് വെറിത്തനം ഹേഅവ്യ്യ്യ് ഇതേമ് മമ്മൂക്ക ഉമ്മ്വ്വാഹ്ഹ്ഹ്ഹ്,
ഇഷ് ക്കിൽ വസുധ വാങ്ങി കൊടുത്ത ഷർട്ട് കുമ്പളങ്ങിയിൽ ഇട്ട് ഷെയിൻ മാതൃകയായി,ഇഷ് ക്കിൽ വസുധ വാങ്ങി കൊടുത്ത ഷർട്ട് കുമ്പളങ്ങിയിൽ ഇട്ട് ഷെയിൻ മാതൃകയായി,
shylock and big brother ikka um ettanum vendum nammale thrill adipikkum,ശ്യ്ലോച്ക് അന്ദ് ബിഗ് ബ്രോഥേര് ഇക്ക ഉമ് ഏത്തനുമ് വേന്ദുമ് നമ്മലേ ഥ്രില്ല് അദിപിക്കുമ്,
ahha padam oomban vallaya karanam onnum venda ellam ippo pidi kittu,അഹ്ഹ പദമ് ഊമ്ബന് വല്ലയ കരനമ് ഓന്നുമ് വേന്ദ ഏല്ലമ് ഇപ്പോ പിദി കിത്തു,
മൂക്കുത്തി ചേച്ചി എന്നാണാവോ സിനിമയിൽ എന്ന് ആലോചിച്ച് ഇരിക്കുമ്പോഴണ് ഇവിടെ കണ്ടത് എന്തായാലും ഇത് പോളികും,മൂക്കുത്തി ചേച്ചി എന്നാണാവോ സിനിമയിൽ എന്ന് ആലോചിച്ച് ഇരിക്കുമ്പോഴണ് ഇവിടെ കണ്ടത് എന്തായാലും ഇത് പോളികും,
sunny chechi fans like adi,സുന്ന്യ് ചേചി fന്സ് ലികേ അദി,
പടം ഒന്നിൽ കൂടുതൽ തവണ കണ്ടവർ ഉണ്ടോ,പടം ഒന്നിൽ കൂടുതൽ തവണ കണ്ടവർ ഉണ്ടോ,
etta formula one mati pidi bore akunu,ഏത്ത fോര്മുല ഓനേ മതി പിദി ബോരേ അകുനു,
onum parayanila elarum pwoli bgm song elam pwoli,ഓനുമ് പരയനില ഏലരുമ് പ്വോലി ബ്ഗ്മ് സോന്ഗ് ഏലമ് പ്വോലി,
mr സിദ്ധിഖ് നിങ്ങളും ഹീറോയിസത്തിന്റെ പിറകിൽ പോകാൻ തുടങ്ങി അല്ലേ നിങ്ങളുടെ ആത്മവിശ്വാസം നഷ്ടപ്പെട്ടു തുടങ്ങി,മ്ര് സിദ്ധിഖ് നിങ്ങളും ഹീറോയിസത്തിന്റെ പിറകിൽ പോകാൻ തുടങ്ങി അല്ലേ നിങ്ങളുടെ ആത്മവിശ്വാസം നഷ്ടപ്പെട്ടു തുടങ്ങി,
comadey aguuum realse aytuu paryaaam,ചോമദേയ് അഗൂഉമ് രേഅല്സേ അയ്തൂ പര്യാഅമ്,
enthina laletanum mammukayum okke ejjaathi mass pornju jose mariyam kidukkaachi padam ufff,ഏന്ഥിന ലലേതനുമ് മമ്മുകയുമ് ഓക്കേ ഏജ്ജാഥി മസ്സ് പോര്ന്ജു ജോസേ മരിയമ് കിദുക്കാചി പദമ് ഉf്f്f്,
ലെ ഷൈലോക്ക് ഊം എന്താ ലെ ബിഗ് ബ്രദർ ആ ട്രെൻഡിങ് 1 ഞാനിങ്ങു എടുക്കുവാ,ലെ ഷൈലോക്ക് ഊം എന്താ ലെ ബിഗ് ബ്രദർ ആ ട്രെൻഡിങ് ൧ ഞാനിങ്ങു എടുക്കുവാ,
ജോ ജോ ഫാൻ ഉണ്ടെങ്കിൽ ഒന്നു ഞെക്കിക്കേ,ജോ ജോ ഫാൻ ഉണ്ടെങ്കിൽ ഒന്നു ഞെക്കിക്കേ,
15k views and 16k likes xd,൧൫ക് വിഏവ്സ് അന്ദ് ൧൬ക് ലികേസ് ക്ഷ്ദ്,
ehhhh paat vannnoooo ittychayn ishtmmm,ഏഹ്ഹ്ഹ്ഹ് പാത് വന്ന്നൂഊ ഇത്ത്യ്ചയ്ന് ഇശ്ത്മ്മ്മ്,
00 52 to 00 56 ee car skidding cinemayil illallo,൦൦ ൫൨ തോ ൦൦ ൫൬ ഈ ചര് സ്കിദ്ദിന്ഗ് ചിനേമയില് ഇല്ലല്ലോ,
ennalum ithrem kashttappettu dislike adikkunnadhu enthinanavo,ഏന്നലുമ് ഇഥ്രേമ് കശ്ത്തപ്പേത്തു ദിസ്ലികേ അദിക്കുന്നധു ഏന്ഥിനനവോ,
katta waiting april 12 fans show ticket kitivar like adikuka,കത്ത വൈതിന്ഗ് അപ്രില് ൧൨ fന്സ് ശോവ് തിച്കേത് കിതിവര് ലികേ അദികുക,
1 48 illl dileepettante lookkum അഭിനയവും,൧ ൪൮ ഇല്ല്ല് ദിലീപേത്തന്തേ ലൂക്കുമ് അഭിനയവും,
വരിക്കാശ്ശേരിമന കാണാൻ പോയപ്പോ മാമാങ്കം ഫിലിമിന് വേണ്ടി സെറ്റ് ഇടുകയായിരുന്നു അവിടെ ഓട് മുഴുവൻ വൈക്കോൽ കൊണ്ട് മൂടിയിരുന്നു,വരിക്കാശ്ശേരിമന കാണാൻ പോയപ്പോ മാമാങ്കം ഫിലിമിന് വേണ്ടി സെറ്റ് ഇടുകയായിരുന്നു അവിടെ ഓട് മുഴുവൻ വൈക്കോൽ കൊണ്ട് മൂടിയിരുന്നു,
mass dialogue magane kola gond la iruken kollama vida maten,മസ്സ് ദിഅലോഗുഏ മഗനേ കോല ഗോന്ദ് ല ഇരുകേന് കോല്ലമ വിദ മതേന്,
best actor movie pole feel ayavar like adi,ബേസ്ത് അച്തോര് മോവിഏ പോലേ fീല് അയവര് ലികേ അദി,
ഇത് കൊള്ളാം തീ പാറും,ഇത് കൊള്ളാം തീ പാറും,
മരണവീട്ടിൽ നിന്ന് ആണോടെ ട്രൈലെർ എഡിറ്റ് ചെയ്യുന്നത് അതേ മൂഡ്,മരണവീട്ടിൽ നിന്ന് ആണോടെ ട്രൈലെർ എഡിറ്റ് ചെയ്യുന്നത് അതേ മൂഡ്,
anna pwoli ufff maranom mass maranom,അന്ന പ്വോലി ഉf്f്f് മരനോമ് മസ്സ് മരനോമ്,
mukhuthi kandille paavangal poyi kannadi nok penne,മുഖുഥി കന്ദില്ലേ പാവന്ഗല് പോയി കന്നദി നോക് പേന്നേ,
trailer adipwoli aaarnu but bgm il aaanu kalanjath bgm cinema il enkilum nallath indaayal mathiyarnu trailer edit cheythavana aadhyam idikkanam immathiri kidukachi trailer nu oru bgm um kodkand erakkiyathinu,ത്രൈലേര് അദിപ്വോലി ആഅര്നു ബുത് ബ്ഗ്മ് ഇല് ആഅനു കലന്ജഥ് ബ്ഗ്മ് ചിനേമ ഇല് ഏന്കിലുമ് നല്ലഥ് ഇന്ദായല് മഥിയര്നു ത്രൈലേര് ഏദിത് ചേയ്ഥവന ആധ്യമ് ഇദിക്കനമ് ഇമ്മഥിരി കിദുകചി ത്രൈലേര് നു ഓരു ബ്ഗ്മ് ഉമ് കോദ്കന്ദ് ഏരക്കിയഥിനു,
angana pritviye kanan 5 july,അന്ഗന പ്രിത്വിയേ കനന് ൫ ജുല്യ്,
enikk ee actress inte pere aritilla,ഏനിക്ക് ഈ അച്ത്രേസ്സ് ഇന്തേ പേരേ അരിതില്ല,
e oru trailarinu vendiyanu njan kathirunnathu powliyanu kiduvanu katta massanu,ഏ ഓരു ത്രൈലരിനു വേന്ദിയനു ന്ജന് കഥിരുന്നഥു പോവ്ലിയനു കിദുവനു കത്ത മസ്സനു,
ninte mookkil mookuthiyaano athoo iniyum kandillenkil police inod poyi complaint kodukkuu,നിന്തേ മൂക്കില് മൂകുഥിയാനോ അഥൂ ഇനിയുമ് കന്ദില്ലേന്കില് പോലിചേ ഇനോദ് പോയി ചോമ്പ്ലൈന്ത് കോദുക്കൂ,
ben johnson mani police was soopr idikkokke enna weightaa tovino pora,ബേന് ജോഹ്ന്സോന് മനി പോലിചേ വസ് സൂപ്ര് ഇദിക്കോക്കേ ഏന്ന വേഇഘ്താ തോവിനോ പോര,
ഈ പാട്ട് കേട്ടുകൊണ്ട് കമന്റ് വായിക്കാൻ അടിപൊളിയാ,ഈ പാട്ട് കേട്ടുകൊണ്ട് കമന്റ് വായിക്കാൻ അടിപൊളിയാ,
ഇത് mouse and cat film second പാർട്ട് ആണോ ഒരു ക്രിസ്മസ് പടക്കം പ്രതീക്ഷിക്കുന്നു,ഇത് മോഉസേ അന്ദ് ചത് fില്മ് സേചോന്ദ് പാർട്ട് ആണോ ഒരു ക്രിസ്മസ് പടക്കം പ്രതീക്ഷിക്കുന്നു,
lucifer mass dialogues ellam onnu comment cheyammo,ലുചിfേര് മസ്സ് ദിഅലോഗുഏസ് ഏല്ലമ് ഓന്നു ചോമ്മേന്ത് ചേയമ്മോ,
ട്രൈലെർ പോരാ mamooty ട്രയ്ലർ സൂപ്പർ ശയിലൊക്,ട്രൈലെർ പോരാ മമൂത്യ് ട്രയ്ലർ സൂപ്പർ ശയിലൊക്,
തണ്ണീർ മത്തൻ ദിനങ്ങൾ ഇതെന്ത് പേര് എന്നോർത്ത് അവസാന നിമിഷം തീയറ്ററിലേക്ക് ഓടിക്കയറിയതായിരുന്നു രണ്ട് സറ്റൊഴിവുള്ളൂ പിന്നെ ഹൗസ്ഫുൾ ഓഹോ നമ്മുടെ കുമ്പളങ്ങീലെ പയ്യൻ അവന്റെ വീട് സ്കൂൾ കൂട്ടുകാർ പ്രണയം സങ്കടങ്ങൾ ലാബ് ടൂർ ഗോതുരുത്ത് ചേന്ദമംഗലം കടമക്കുടി അങ്ങിനെ നമ്മുടെ സ്വന്തം നാടുകൾ മനോഹരമായ ഫ്രെയ്മിൽ കീർത്തീ അജു വർഗ്ഗീസ് ആരാന്നറിയാത്ത രവി സാർ ജെയ് സാ എന്ന വിളി ഭൂമിക്കൊരു ചരമഗീതം ചങ്കിനു വരാൻ പറ്റാതെ പോയ ടൂർ സ്റ്റെഫിയുടെ നിർവികാരത ഒരിടത്ത് ചിരിയവസാനിക്കുമ്പോൾ മറ്റൊരുവശത്ത് ചിരി തുടങ്ങുന്ന ഓരോ ഡയലോഗിനും എവിടെ നിന്നെങ്കിലും കൈയ്യടിയുറപ്പ് എന്ന മട്ടിലുള്ള ഒരു അടിപൊളി തീയറ്റർ അന്തരീക്ഷം രണ്ടര മണിക്കൂർ ജാതിക്കാതേട്ടത്തിലും സ്കൂളിലുമായി അലഞ്ഞു നടന്ന മനസ്സ് കുളിർമ്മയുള്ളീ തണ്ണീർമത്തൻ തീരരുതായിരുന്നു എന്നു കൊതിച്ച് തീയറ്ററിലെ ആരവങ്ങൾക്കിടയിൽ നിന്നിറങ്ങിയപ്പോൾ മനസ്സ് വീണ്ടും പിടി തരാതെ വർഷങ്ങൾക്കു മുൻപ് സ്വന്തമായുണ്ടായിരുന്ന സിപ്പപ് ദിനങ്ങളിലായിരുന്നു,തണ്ണീർ മത്തൻ ദിനങ്ങൾ ഇതെന്ത് പേര് എന്നോർത്ത് അവസാന നിമിഷം തീയറ്ററിലേക്ക് ഓടിക്കയറിയതായിരുന്നു രണ്ട് സറ്റൊഴിവുള്ളൂ പിന്നെ ഹൗസ്ഫുൾ ഓഹോ നമ്മുടെ കുമ്പളങ്ങീലെ പയ്യൻ അവന്റെ വീട് സ്കൂൾ കൂട്ടുകാർ പ്രണയം സങ്കടങ്ങൾ ലാബ് ടൂർ ഗോതുരുത്ത് ചേന്ദമംഗലം കടമക്കുടി അങ്ങിനെ നമ്മുടെ സ്വന്തം നാടുകൾ മനോഹരമായ ഫ്രെയ്മിൽ കീർത്തീ അജു വർഗ്ഗീസ് ആരാന്നറിയാത്ത രവി സാർ ജെയ് സാ എന്ന വിളി ഭൂമിക്കൊരു ചരമഗീതം ചങ്കിനു വരാൻ പറ്റാതെ പോയ ടൂർ സ്റ്റെഫിയുടെ നിർവികാരത ഒരിടത്ത് ചിരിയവസാനിക്കുമ്പോൾ മറ്റൊരുവശത്ത് ചിരി തുടങ്ങുന്ന ഓരോ ഡയലോഗിനും എവിടെ നിന്നെങ്കിലും കൈയ്യടിയുറപ്പ് എന്ന മട്ടിലുള്ള ഒരു അടിപൊളി തീയറ്റർ അന്തരീക്ഷം രണ്ടര മണിക്കൂർ ജാതിക്കാതേട്ടത്തിലും സ്കൂളിലുമായി അലഞ്ഞു നടന്ന മനസ്സ് കുളിർമ്മയുള്ളീ തണ്ണീർമത്തൻ തീരരുതായിരുന്നു എന്നു കൊതിച്ച് തീയറ്ററിലെ ആരവങ്ങൾക്കിടയിൽ നിന്നിറങ്ങിയപ്പോൾ മനസ്സ് വീണ്ടും പിടി തരാതെ വർഷങ്ങൾക്കു മുൻപ് സ്വന്തമായുണ്ടായിരുന്ന സിപ്പപ് ദിനങ്ങളിലായിരുന്നു,
kalki tovinothomas look vera level,കല്കി തോവിനോഥോമസ് ലൂക് വേര ലേവേല്,
ithra nalla pattinem ikkade dancinem aano ivanmaru trollunath,ഇഥ്ര നല്ല പത്തിനേമ് ഇക്കദേ ദന്ചിനേമ് ആനോ ഇവന്മരു ത്രോല്ലുനഥ്,
dulquer fans comment prithviraj fans like,ദുല്qുഏര് fന്സ് ചോമ്മേന്ത് പ്രിഥ്വിരജ് fന്സ് ലികേ,
mamooka enn uyir enn anbu enn singamda enn muth mani 300crore adikum,മമൂക ഏന്ന് ഉയിര് ഏന്ന് അന്ബു ഏന്ന് സിന്ഗമ്ദ ഏന്ന് മുഥ് മനി ൩൦൦ച്രോരേ അദികുമ്,
teaser polum kanathe dislike adichi 500 jimittolikal mathrikayayi,തേഅസേര് പോലുമ് കനഥേ ദിസ്ലികേ അദിചി ൫൦൦ ജിമിത്തോലികല് മഥ്രികയയി,
